{
  "branch": "main",
  "cargo_lock_sha256": "6235bfb8fbac6175b48fe3216d4496a1a043f7bb5891568836bee7ce67bc7dd6",
  "commit": "da6461a9dab5fc7ce85459c818c0356bb63f467b",
  "dirty": false,
  "interface_id": "portable-interface-v2",
  "p0a_pointer_sha256": "c3ac49fdd2aecddb677bd315678d0f0d72bba3fbd92f773289ef98871505e15d",
  "phase_id": "P1A",
  "profile_id": "prototype-windows-5090-v1",
  "schema": "python-slm-p1a-source-identity-v1",
  "schema_bundle_sha256": "33d0ce3f0a47ba77f2516582ad54c412ff03071170a2b4abac4ab1724e05c8a6",
  "support_tier": "implemented",
  "tree": "b7000f3e7210af6455bd81c5d38ddab03e2e6fed",
  "verifier_source_sha256": "69adc9882ad4dd4be16e8e8eaf710f452bd6116cba6ff5ff05a8296c8b1e09b9"
}
